[
  {
    "id": "65b5dbe6-37bc-460f-a10f-bea762c1c9ff",
    "name": "Get to the Ship",
    "format": "Standard",
    "scenario": "A",
    "back_id": "e938bd34-60e7-4dc3-8cdb-52187f115723",
    "image": "skirmish-missions/get-to-the-ship.png"
  },
  {
    "id": "580c30c8-dbff-4e5d-b278-f02b766bbf17",
    "name": "Smuggled Goods",
    "format": "Standard",
    "scenario": "B",
    "back_id": "e938bd34-60e7-4dc3-8cdb-52187f115723",
    "image": "skirmish-missions/smuggled-goods.png"
  },
  {
    "id": "d9434345-b1c1-42a8-9589-74b280795564",
    "name": "Close to Home",
    "format": "Standard",
    "scenario": "A",
    "back_id": "e938bd34-60e7-4dc3-8cdb-52187f115723",
    "image": "skirmish-missions/close-to-home.png"
  },
  {
    "id": "a1e3724f-01c0-4318-9646-8f731b49d873",
    "name": "Raiding Party",
    "format": "Standard",
    "scenario": "B",
    "back_id": "e938bd34-60e7-4dc3-8cdb-52187f115723",
    "image": "skirmish-missions/raiding-party.png"
  },
  {
    "id": "d6a2b0b5-e3e5-46af-a28e-2bc82251d0ce",
    "name": "Lost Knowledge",
    "format": "Standard",
    "scenario": "A",
    "back_id": "e938bd34-60e7-4dc3-8cdb-52187f115723",
    "image": "skirmish-missions/lost-knowledge.png"
  },
  {
    "id": "3f839a21-39e0-4f91-8556-06d7f80892e2",
    "name": "Leave No Evidence",
    "format": "Standard",
    "scenario": "B",
    "back_id": "e938bd34-60e7-4dc3-8cdb-52187f115723",
    "image": "skirmish-missions/leave-no-evidence.png"
  },
  {
    "id": "580452b1-a628-4c17-9462-1c485e333e02",
    "name": "Prison Break",
    "format": "Standard",
    "scenario": "A",
    "back_id": "e938bd34-60e7-4dc3-8cdb-52187f115723",
    "image": "skirmish-missions/prison-break.png"
  },
  {
    "id": "aa19125f-282a-4233-b7d1-5ce49e15df9b",
    "name": "Infiltration",
    "format": "Standard",
    "scenario": "B",
    "back_id": "e938bd34-60e7-4dc3-8cdb-52187f115723",
    "image": "skirmish-missions/infiltration.png"
  },
  {
    "id": "62958d26-caaa-4129-9f26-c2a2cb3b9990",
    "name": "Local Trouble",
    "format": "Standard",
    "scenario": "A",
    "back_id": "e938bd34-60e7-4dc3-8cdb-52187f115723",
    "image": "skirmish-missions/local-trouble.png"
  },
  {
    "id": "6afc3910-c3bb-4aca-9ef7-31aad1d9f8d4",
    "name": "Sabacc Standoff",
    "format": "Standard",
    "scenario": "B",
    "back_id": "e938bd34-60e7-4dc3-8cdb-52187f115723",
    "image": "skirmish-missions/sabacc-standoff.png"
  },
  {
    "id": "2c509d92-e693-460b-b9fd-58ffada5b03e",
    "name": "Hazardous Materials",
    "format": "Standard",
    "scenario": "A",
    "back_id": "e938bd34-60e7-4dc3-8cdb-52187f115723",
    "image": "skirmish-missions/hazardous-materials.png"
  },
  {
    "id": "831340f8-ffe6-4785-8a64-24b06bf8cee1",
    "name": "Breakthrough",
    "format": "Standard",
    "scenario": "B",
    "back_id": "e938bd34-60e7-4dc3-8cdb-52187f115723",
    "image": "skirmish-missions/breakthrough.png"
  },
  {
    "id": "6dd90bfa-607a-4a3e-beb3-0af66747a62b",
    "name": "Shadow War",
    "format": "Standard",
    "scenario": "A",
    "back_id": "e938bd34-60e7-4dc3-8cdb-52187f115723",
    "image": "skirmish-missions/shadow-war.png"
  },
  {
    "id": "dfc7f1fa-7b0a-4e4c-9d1e-f9537a0286ba",
    "name": "Weapons Project",
    "format": "Standard",
    "scenario": "B",
    "back_id": "e938bd34-60e7-4dc3-8cdb-52187f115723",
    "image": "skirmish-missions/weapons-project.png"
  },
  {
    "id": "dceb55b6-b241-4320-805f-69df336d4e46",
    "name": "Stolen Schematics",
    "format": "Standard",
    "scenario": "A",
    "back_id": "e938bd34-60e7-4dc3-8cdb-52187f115723",
    "image": "skirmish-missions/stolen-schematics.png"
  },
  {
    "id": "1272e42e-4d4f-4776-aebe-c0a6d6b5e61a",
    "name": "Stranded",
    "format": "Standard",
    "scenario": "B",
    "back_id": "e938bd34-60e7-4dc3-8cdb-52187f115723",
    "image": "skirmish-missions/stranded.png"
  },
  {
    "id": "4141846f-a963-4a1b-8fa1-69e1aa9e00f1",
    "name": "Data Heist",
    "format": "Standard",
    "scenario": "A",
    "back_id": "e938bd34-60e7-4dc3-8cdb-52187f115723",
    "image": "skirmish-missions/data-heist.png"
  },
  {
    "id": "874c35e6-7230-4691-8386-3f26d53e8399",
    "name": "Incoming Transmission",
    "format": "Standard",
    "scenario": "B",
    "back_id": "e938bd34-60e7-4dc3-8cdb-52187f115723",
    "image": "skirmish-missions/incoming-transmission.png"
  },
  {
    "id": "9be39bfd-8bb8-4a90-ae16-32e02d59262a",
    "name": "Mind of its Own",
    "format": "Standard",
    "scenario": "A",
    "back_id": "e938bd34-60e7-4dc3-8cdb-52187f115723",
    "image": "skirmish-missions/mind-of-its-own.png"
  },
  {
    "id": "3aef210c-5bf9-48e5-83dc-c730f08534fa",
    "name": "Most Dangerous Game",
    "format": "Standard",
    "scenario": "B",
    "back_id": "e938bd34-60e7-4dc3-8cdb-52187f115723",
    "image": "skirmish-missions/most-dangerous-game.png"
  },
  {
    "id": "0471b990-fdef-46a2-a553-ecfcd0391aa2",
    "name": "Drinks and Dealings",
    "format": "Standard",
    "scenario": "A",
    "back_id": "e938bd34-60e7-4dc3-8cdb-52187f115723",
    "image": "skirmish-missions/drinks-and-dealings.png"
  },
  {
    "id": "d50072fc-d53a-4e90-a598-4a2842b70a61",
    "name": "Battlefield Engineering",
    "format": "Standard",
    "scenario": "B",
    "back_id": "e938bd34-60e7-4dc3-8cdb-52187f115723",
    "image": "skirmish-missions/battlefield-engineering.png"
  },
  {
    "id": "0a2301da-6b3b-4122-a392-d1455c73df68",
    "name": "Ancient Knowledge",
    "format": "Standard",
    "scenario": "A",
    "back_id": "e938bd34-60e7-4dc3-8cdb-52187f115723",
    "image": "skirmish-missions/ancient-knowledge.png"
  },
  {
    "id": "19604de8-5b37-4d27-ac68-ab4b71aa0192",
    "name": "Volatile Materials",
    "format": "Standard",
    "scenario": "B",
    "back_id": "e938bd34-60e7-4dc3-8cdb-52187f115723",
    "image": "skirmish-missions/volatile-materials.png"
  },
  {
    "id": "28b3ffd2-73bd-45ba-8db0-5e5240a9598b",
    "name": "Balance of the Force (Skirmish Mission)",
    "format": "Standard",
    "scenario": "A",
    "back_id": "e938bd34-60e7-4dc3-8cdb-52187f115723",
    "image": "skirmish-missions/balance-of-the-force-skirmish-mission.png"
  },
  {
    "id": "c9244a24-7d76-456e-9f6b-841118af0141",
    "name": "Chosen of the Force",
    "format": "Standard",
    "scenario": "B",
    "back_id": "e938bd34-60e7-4dc3-8cdb-52187f115723",
    "image": "skirmish-missions/chosen-of-the-force.png"
  },
  {
    "id": "7e2d93da-130c-4f01-8e5c-678e5e17205d",
    "name": "Data Run",
    "format": "Standard",
    "scenario": "A",
    "back_id": "e938bd34-60e7-4dc3-8cdb-52187f115723",
    "image": "skirmish-missions/data-run.png"
  },
  {
    "id": "9e4c5a4e-3560-4849-bc94-53a97d13a474",
    "name": "Targeting Computers",
    "format": "Standard",
    "scenario": "B",
    "back_id": "e938bd34-60e7-4dc3-8cdb-52187f115723",
    "image": "skirmish-missions/targeting-computers.png"
  },
  {
    "id": "4cc02712-0b1e-44db-b30c-0d92933fe51c",
    "name": "The Art of Robotics",
    "format": "Standard",
    "scenario": "A",
    "back_id": "e938bd34-60e7-4dc3-8cdb-52187f115723",
    "image": "skirmish-missions/the-art-of-robotics.png"
  },
  {
    "id": "817a1b61-e737-411f-8d6a-3b4708047aed",
    "name": "Experimental Weapons",
    "format": "Standard",
    "scenario": "B",
    "back_id": "e938bd34-60e7-4dc3-8cdb-52187f115723",
    "image": "skirmish-missions/experimental-weapons.png"
  },
  {
    "id": "119ea61a-b832-42ea-905b-204678232b1b",
    "name": "Reprogrammed",
    "format": "Standard",
    "scenario": "A",
    "back_id": "e938bd34-60e7-4dc3-8cdb-52187f115723",
    "image": "skirmish-missions/reprogrammed.png"
  },
  {
    "id": "11acf20f-22b5-4e32-9a3c-b36399632566",
    "name": "Deception Game",
    "format": "Standard",
    "scenario": "B",
    "back_id": "e938bd34-60e7-4dc3-8cdb-52187f115723",
    "image": "skirmish-missions/deception-game.png"
  },
  {
    "id": "a9caf810-4451-4f3e-92ed-c9421c2bb7eb",
    "name": "Unknown Treasures",
    "format": "Standard",
    "scenario": "A",
    "back_id": "e938bd34-60e7-4dc3-8cdb-52187f115723",
    "image": "skirmish-missions/unknown-treasures.png"
  },
  {
    "id": "832c466f-2d31-48c1-bd20-5c03b0ff4994",
    "name": "Something in the Air",
    "format": "Standard",
    "scenario": "B",
    "back_id": "e938bd34-60e7-4dc3-8cdb-52187f115723",
    "image": "skirmish-missions/something-in-the-air.png"
  },
  {
    "id": "cedae60a-8765-45cd-8692-84db8a2b11d1",
    "name": "Uplink",
    "format": "Standard",
    "scenario": "A",
    "back_id": "e938bd34-60e7-4dc3-8cdb-52187f115723",
    "image": "skirmish-missions/uplink.png"
  },
  {
    "id": "683c988d-5bff-4c1e-8e6a-eab8893b702e",
    "name": "Delivery System",
    "format": "Standard",
    "scenario": "B",
    "back_id": "e938bd34-60e7-4dc3-8cdb-52187f115723",
    "image": "skirmish-missions/delivery-system.png"
  },
  {
    "id": "c1be6689-bd3c-41f1-9357-fefc1b6a23af",
    "name": "Lair of the Dianoga",
    "format": "Standard",
    "scenario": "A",
    "back_id": "e938bd34-60e7-4dc3-8cdb-52187f115723",
    "image": "skirmish-missions/lair-of-the-dianoga.png"
  },
  {
    "id": "1698e0db-feca-4497-8f31-0014a93e6285",
    "name": "One Man\u2019s Trash",
    "format": "Standard",
    "scenario": "B",
    "back_id": "e938bd34-60e7-4dc3-8cdb-52187f115723",
    "image": "skirmish-missions/one-man-s-trash.png"
  },
  {
    "id": "d79d752d-58e0-4b3c-82b2-773ee5278815",
    "name": "Safe and Sound",
    "format": "Standard",
    "scenario": "A",
    "back_id": "e938bd34-60e7-4dc3-8cdb-52187f115723",
    "image": "skirmish-missions/safe-and-sound.png"
  },
  {
    "id": "cff42d39-2f69-4322-a707-6b31f7ed4260",
    "name": "Rapid Adaptation",
    "format": "Standard",
    "scenario": "B",
    "back_id": "e938bd34-60e7-4dc3-8cdb-52187f115723",
    "image": "skirmish-missions/rapid-adaptation.png"
  },
  {
    "id": "59f9f427-86ab-4385-b152-8ba608b46ecd",
    "name": "Blood on the Snow",
    "format": "Four Player Free-For-All",